https://creativecommons.org/licenses/by/4.0%||Praskievicz, Sarah|||Kaufman, Casey|3/13/2020|John C. Hodges Library, University of Tennessee, Knoxville|University of North Carolina, Greensboro|motion pictures (visual works) http://vocab.getty.edu/aat/300136900|Interview with Sarah Praskievicz, professor with the Department of Geography, Environment, and Sustainability at the University of North Carolina at Greensboro. Praskievicz discusses her research on the effects of the fire on the water systems of the Great Smoky Mountain National Park. Conducted over Zoom.|Fire and forestry experts||Soils--Effect of fires on|River surveys||Great Smoky Mountains National Park (N.C. and Tenn.) ||||Would you state your name and tell us about your role at UNC Greensborough?|0:01:24|How did you find yourself moving into this career?|0:02:04|What is your general research area prior to the wildfires?|0:02:55|Can you talk about how this fire was an anomaly?|0:04:33|What was your experience during the time of the wildfires?|0:06:03|How did you decide on your research concerning the fire and your methodologies?|0:08:58|When you're surveying the wood, what is that process like?|0:14:03|How did you pick your plots for analysis?|0:16:42|After you gather all this data, what is the next step of the process?|0:17:55|Do you see this as a benefit of the wildfire?|0:22:55|How do you see your research being built upon? Do you think other scientists in other fields may use the data you've collected?|0:25:51|What are the other impacts from your research on your discipline and the public?|0:27:30|Is there anything else that we haven't talked about that you would like to share?|0:31:45|||||||||||||||||||||||||||||||||||||||||||||||||||||||||||||||||||||||||||||||||||||||||||||||||||||||||||||||||||||||||||||||||||||||||||||||||||||||||||||||7/28/1986|Southbridge, MA|Visiting since 2014 for professional and recreation reasons|%B.S. Environmental Studies, Southern Oregon University, 2004;
M.S. Geography, Portland State University, 2009; 
Ph.D. Geography, University of Oregon, 2014 
%|Assistant Professor, Dept. of Geography, Environment, and Sustainability, University of North Carolina at Greensboro, 2018-present||Started doing fieldwork in the Smokies in Summer of 2019 after starting position at UNCG.|The Rising from the Ashes Oral History Project collects personal accounts of the Chimney Tops II Wildfires of 2016, and The University of Tennessee holds no liability for statements made in the recordings. These accounts reflect the opinions of the narrators, and thus they are subjective and should not be considered verified or comprehensive. Oral history interviews may be used alongside other primary and secondary source materials to gain a fuller understanding of historical events.||
20200313_Schwartz_John-Reamer_Sally||Interview with John Schwartz and Sally Reamer, 2020-03-13|0:00:31|0:36:30|%Creative Commons Attribution 4.0 International License 
https://creativecommons.org/licenses/by/4.0%||Schwartz, John|Reamer, Sally||Wise, Ken|3/13/2020|John C. Hodges Library, University of Tennessee, Knoxville|John C. Hodges Library, University of Tennessee, Knoxville|motion pictures (visual works) http://vocab.getty.edu/aat/300136900|Interview with John Schwartz, professor with the Department of Civil and Environmental Engineering at the University of Tennessee, and Sally Reamer, graduate student in the same department. The two discuss the effects of the fire upon the water system inside the Great Smoky Mountains National Park.|Fire and forestry experts||Soils--Effect of fires on|River surveys||Great Smoky Mountains National Park (N.C. and Tenn.) ||||Can you state your name and relationship to the University of Tennessee?|0:01:06|Can you give a reason why you agreed to the interview?|0:01:56|Sally, how long have you been in the area?|0:02:25|When did each of you first become aware that there was a fire in the Smokies?|0:03:00|What was your reaction when you first heard that the fire had gotten out of control?|0:04:50|When you called your friend in Gatlinburg, what did you find out?|0:05:40|When did you first see the results of the fire?|0:06:20|Can you describe what your research in the park had been?|0:07:15|What was your role in the project and what was your interest?|0:10:01|What kind of impact from the fire were you looking for?|0:11:28|What did you hope to find studying the stream? Did the fire release sulfur?|0:12:32|Did you see any differences amongst the varying burn level sites?|0:15:19|Can you explain what organic content means?|0:16:19|What other differences did you see?|0:17:02|What distinctions are you seeing between this fire and ones out West?|0:17:35|Did the decrease in nitrogen surprise you?|0:19:44|What other hypotheses did you have going into this?|0:20:38|Why did you expect the fire to influence the streams?|0:21:38|Were there any other hypotheses you had?|0:22:03|Can you describe what the recovery was like and the severity?|0:23:01|Isn't a fire like this a natural occurrence?|0:24:04|What is the trajectory of your research? Where do you see it going?|0:25:25|Is this UT that's doing the long-term water monitoring project?|0:27:07|Can you talk about the value of this research for the average person?|0:27:50|Hae you run across any research stating that the water quality has affected other living things in the forest?|0:29:42|Was there anything from the fire to your research findings that was surprising?|0:30:38|Do you think another fire like this could happen?|0:33:38|Is there anything else that you would like to share?|0:34:33|||||||||||||||||||||||||||||||||||||||||||||||||||||||||||||||||||||||||||||||||||||||||||||||||||||||||||||||||||||||||||||||||%Sally:
01/30/1996

John:
02/27/1959%|%Sally:
Columbia, SC

John:
St. Louis, MO%||%Sally:
B.S. Environmental Engineering, Clemson University, 2018; 
M.S. Environmental Engineering, University of Tennessee Knoxville, 2020

John:
Ph.D. Environmental Engineering%|%Sally: 
Graduate Research Assistant at UTK

John:
30+ years as professional engineer%|||The Rising from the Ashes Oral History Project collects personal accounts of the Chimney Tops II Wildfires of 2016, and The University of Tennessee holds no liability for statements made in the recordings. These accounts reflect the opinions of the narrators, and thus they are subjective and should not be considered verified or comprehensive. Oral history interviews may be used alongside other primary and secondary source materials to gain a fuller understanding of historical events.||
20200313_Sweeney_Stanton||Interview with Stanton Sweeney, 2020-03-13|0:00:10|0:31:35|%Creative Commons Attribution 4.0 International License 
https://creativecommons.org/licenses/by/4.0%||Sweeney, Stanton|||Kaufman, Casey|3/13/2020|John C. Hodges Library, University of Tennessee, Knoxville|John C. Hodges Library, University of Tennessee, Knoxville|motion pictures (visual works) http://vocab.getty.edu/aat/300136900||Individuals/families suffering losses|||||||||Can you state your name and tell us a little about yourself?|0:00:46|What was it like moving from Memphis, a city in West Tennessee, to a tourist city?|0:01:39|Did you grow up going to Gatlinburg?|0:02:04|Can you tell us what you're doing at UT?|0:02:26|What do you recall about the months leading up to the fire?|0:02:51|What time was it that you evacuated to Sevierville?|0:06:42|Did yo think that you would be back?|0:07:04|Did all of your family leave together?|0:08:07|Were you communicating with your friends that hadn't evacuated?|0:10:20|What were you discussing with your friends and your mom after seeing the fire on the news?|0:10:40|What time did you go to sleep that night?|0:11:41|What time did your dad reunite with your family?|0:12:43|Was your car also destroyed?|0:16:50|Where was the supply center located?|0:19:27|Did some of your friends also lose their homes?|0:20:15|Is the community center you mentioned Rocky Top?|0:21:22|How did the teachers and faculty at school handle the return?|0:22:00|Now that it's been three and a half years, what is your assessment of Gatlinburg's recovery?|0:24:00|Do people still come to Gatlinburg and ask about the fire?|0:25:00|How has the wildfire affected you personally?|0:25:30|Do you stay in touch with the people who were in your old neighborhood?|0:26:45|How do you feel the fires impacted community relations?|0:27:40|Have you started thinking about future provisions in caswe something does happen again?|0:28:03|Have you had a chance to get new family pictures done?|0:29:02|Are there any other surprising or positive outcomes from the fire?|0:30:17|Is there anything elese that you want to share?||||||||||||||||||||||||||||||||||||||||||||||||||||||||||||||||||||||||||||||||||||||||||||||||||||||||||||||||||||||||||||||||||||||11/23/2000|Memphis, TN||Highschool|Hotel Front Desk Manager|Boy Scouts of America||The Rising from the Ashes Oral History Project collects personal accounts of the Chimney Tops II Wildfires of 2016, and The University of Tennessee holds no liability for statements made in the recordings. These accounts reflect the opinions of the narrators, and thus they are subjective and should not be considered verified or comprehensive. Oral history interviews may be used alongside other primary and secondary source materials to gain a fuller understanding of historical events.||
20200313_Braunstein_Jessica||Interview with Jessica Braunstein, 2020-03-13|0:00:10|0:31:18|%Creative Commons Attribution 4.0 International License 
https://creativecommons.org/licenses/by/4.0%||Braunstein, Jessica|||Wise, Ken|3/13/2020|John C. Hodges Library, University of Tennessee, Knoxville|John C. Hodges Library, University of Tennessee, Knoxville|motion pictures (visual works) http://vocab.getty.edu/aat/300136900|Interview with Jessica Braunstein, PhD student with the University of Tennessee. Braunstein discusses her research concerning black bears in the Great Smoky Mountains National Park, and tracking the animals location. She talks about the response of the black bears to the wildfires, and the aftereffects on the habitat and behavior of the bears.|Fire and forestry experts||Black bear|Animals--Effect of fires on||Great Smoky Mountains National Park (N.C. and Tenn.) ||||Can you state your name and tell us how you are related to the University of Tennessee?|0:00:46|Can you tell us how long you have been in the area and your familiarity with the Smokies?|0:01:24|What led your interest in the area of black bears in the Smokies?|0:02:00|When did you first become aware that there was a fire in the Smokies?|0:02:54|Where were you when you heard about the fire reaching Gatlinburg?|0:03:44|Do you remember what day it was you heard?|0:04:18|What was your reaction when you first saw the park afterwards?|0:04:52|What was your research project in the Smokies with the bears?|0:05:40|Were any of these collared bears' homesite in the burn sites?|0:08:09|When you track these bears, how do you track them?|0:09:04|What ws your experience like going to look at the GPS data during the fire?|0:09:56|What did you see from the data?|0:11:15|Do you have any speculations about why the bears didn't leave to avoid the smoke?|0:12:08|Of the collared bears, how did they survive in their dens with the fire?|0:13:55|Can you describe what a typical den looks like for a bear?|0:15:09|So you didn't have any female bears up in trees in the areas that got scorched?|0:16:25|In looking at the bear movement during the fire, what did you find that was interesting or odd?|0:16:40|That particular bear didn't leave the tree during the fire?|0:19:44|So the bears came right back after the fire and continued their business?|0:20:00|If the bears are goinginto Gatlinburg for food, then do they need to be near the food source?|0:20:15|What was the hypothesis you were working with when you stated in 2015?|0:20:51|Did your hypothesis prove to be true?|0:21:56|Did the fire change the habits of the bears at all?|0:22:14|Did the bear in the Chimney Tops area return after the fire?|0:23:18|Can you tell us what the trajectory of your research is? Where are you going to take it from here?|0:23:45|Is there anything about your research and the fire itself that would be important for the average person to know?|0:25:51|Is there anything about the whole experience that surprised you?|0:27:03|From your perspective, did anything good come out of this fire?|0:28:21|With discussions about another potential fire, what can the park do to better prepare for the future?|0:29:49|Is there anything we haven't discussed that you would like to share?|0:30:56|||||||||||||||||||||||||||||||||||||||||||||||||||||||||||||||||||||||||||||||||||||||||||||||||||||||||||||||||||||||||||||10/22/1990|Daegu, South Korea|Raised in Maryville, TN|%B.S. Biological Sciences, Lee University; 
M.S. Wildlife & Fisheries Science University of Tennessee Knoxville%|Graduate Research Assistant at UTK (2015-present); Biological Science Technician, National Park Service (Great Smoky Mountains)|||The Rising from the Ashes Oral History Project collects personal accounts of the Chimney Tops II Wildfires of 2016, and The University of Tennessee holds no liability for statements made in the recordings. These accounts reflect the opinions of the narrators, and thus they are subjective and should not be considered verified or comprehensive. Oral history interviews may be used alongside other primary and secondary source materials to gain a fuller understanding of historical events.||
20200314_Sweeney_Bob||Interview with Bob Sweeney, 2020-03-14|0:00:03|1:33:57|%Creative Commons Attribution 4.0 International License 
https://creativecommons.org/licenses/by/4.0%||Sweeney, Bob|||Kaufman, Casey|3/14/2020|Park Vista Hotel, Gatlinburg, Tennessee|Park Vista Hotel, Gatlinburg, Tennessee|motion pictures (visual works) http://vocab.getty.edu/aat/300136900|Interview with Bob Sweeney, resident of Gatlinburg. Sweeney describes the fire as a someone who recently moved to the area before suffering losses. He recounts the following days and months in terms of the lessons he learned from the wildfire and the opportunities that it provided.|Individuals/families suffering losses||Evacuation of civilians|||||||Can you state your name and tell us about yourself?|0:00:34|How long have you been in Gatlinburg?|0:00:57|Had you been visiting Gatlinburg as a family?|0:01:33|Can you tell us a little about your family?|0:01:50|Where did you live in relation to downtown Gatlinburg before the fire?|0:02:24|What's it like living in a town like Gatlinburg with a small local population but a large tourist presence?|0:03:11|Can you talk about the Summer and Fall before the fire?|0:04:07|Your son had mentioned that it was his birthday a few days before the fire?|0:05:45|What did you experience the day of the fire?|0:07:29|What time were you talking with your wife about what to take when evacuating?|0:10:13|At what point did you decide to leave for Gatlinburg from West Tennessee?|0:10:57|What was it like that night when you reunited with your family?|0:12:26|How long were you at your friends' house?|0:13:50|What was it like going back to your home for the first time?|0:14:35|Was it within those following three days that you decided to go to your home?|0:15:17|Can you tell us about the months after the fire?||Were you also in the camper for Christmas?||||||||||||||||||||||||||||||||||||||||||||||||||||||||||||||||||||||||||||||||||||||||||||||||||||||||||||||||CUT|0:44:30|||||||||||||||||||||||||||||||||||||||12/28/1968|Booneville, MS||Northeast Mississippi Junior College|Landscape Architecture, Design, and Installation, Tree Cutting, Lawn Care, Store Clerk|||The Rising from the Ashes Oral History Project collects personal accounts of the Chimney Tops II Wildfires of 2016, and The University of Tennessee holds no liability for statements made in the recordings. These accounts reflect the opinions of the narrators, and thus they are subjective and should not be considered verified or comprehensive. Oral history interviews may be used alongside other primary and secondary source materials to gain a fuller understanding of historical events.||
20200314_Sweeney_Stephanie||Interview with Stephanie Sweeney, 2020-03-14|0:00:03|1:17:10|%Creative Commons Attribution 4.0 International License 
https://creativecommons.org/licenses/by/4.0%||Sweeney, Stephanie|||Romans, Laura|3/14/2020|Park Vista Hotel, Gatlinburg, Tennessee|Park Vista Hotel, Gatlinburg, Tennessee|motion pictures (visual works) http://vocab.getty.edu/aat/300136900|Interview with Stephanie Sweeney, resident of Gatlinburg. Sweeney talks about her love for the area and its history, and the hardship of being a new resident to the area before suffering the loss of her home. She also recounts the kindness she found in the community afterwards in receiving donations to start over.|Individuals/families suffering losses||Evacuation of civilians|Hiking||Arrowmont School of Arts and Crafts|Great Smoky Mountains National Park (N.C. and Tenn.) |||Will you state your name and tell us a little about yourself?|0:00:40|Where do your friends that you stayed with, live?|0:23:30|Were your children nervous or concerned during the disaster?|0:28:18|Did you ever go back to your burned cabin?|0:53:48|||||||||||||||||||||||||||||||||||||||||||||||||||||||||||||||||||||||||||||||||||||||||||||||||||||||||||||||||||||||||||||||||||||||||||||||||||||||||||||||||||||||||||||||||11/5/1968|Newton, MS||%Northeast Mississippi Junior College; 
Arrowmont;
Tremont Naturalist Certification%|Dental Assistant, Teacher's Assistant, Homemaker, Homeschooled children for 17 years, Glass Artisan (in home glass studio)|Pittman Center Tree Board, Community Shape Not Singing, Glass Art Demonstrations art Community events and festivals|Hiked 60+ trails in the Smokies, some of them multiple times. Hiked in week leading up to fires. Self learned historian on the local history of Great Smoky Mountains National Park.|The Rising from the Ashes Oral History Project collects personal accounts of the Chimney Tops II Wildfires of 2016, and The University of Tennessee holds no liability for statements made in the recordings. These accounts reflect the opinions of the narrators, and thus they are subjective and should not be considered verified or comprehensive. Oral history interviews may be used alongside other primary and secondary source materials to gain a fuller understanding of historical events.||
20200423_Manifold_Sarina||Interview with Sarina Manifold, 2020-04-23|0:00:25|0:47:44|%Creative Commons Attribution 4.0 International License 
https://creativecommons.org/licenses/by/4.0%||Manifold, Sarina|||Romans, Laura|4/23/2020|Knoxville, Tennessee|North Carolina|motion pictures (visual works) http://vocab.getty.edu/aat/300136900|Interview with Sarina Manifold, Licensed Clinical Social Worker. Manifold discusses her role at the UT Veterinary Clinic offering grief support to staff and families before the fire and how her role continued during the disaster. Conducted over Zoom due to the COVID-19 pandemic.|Medical personnel||Social service|Mental health|Veterinarians|||||Would you state your name and tell us a little about your life and background?|0:01:10|Can you talk about the types of care that you provide for people associated with the vet school?|0:05:20|Are the vets in the clinic both faculty and students?|0:12:27|Is your type of position common among other vet schools and clinics?|0:15:38|What do you remember of the wildfires when it was actually happening?|0:17:50|At what point did you start to realize that these fires would impact your work and that the vet school was going to be needed?|0:19:35|What did your work look like in those days and weeks after the wildfires?|0:22:45|Did you see a difference in people's receptiveness to your services, or more people seeking you out?|0:28:04|How did the wildfires change and inform your work?|0:32:10|Are there any other specific memories that stand out from that time?|0:37:30|How long did you feel like you and the vet school were continuing to see the ramifications of the wildfires?|0:40:12|Is there anything else that seemed surprising or weird going through this time?|0:41:48|Is there anything about your work or that time that we didn't touch on that you would like to share?|0:44:44|||||||||||||||||||||||||||||||||||||||||||||||||||||||||||||||||||||||||||||||||||||||||||||||||||||||||||||||||||||||||||||||||||||||||||||||||||||||||||||||2/21/1980|Fredericksburg, VA||%B.S. Psychology, High Point University;
M.S. Social Work, University of Tennessee Knoxville%|%Licensed Clinical Social Worker: 6 years;
UT Veterinary Medical Center: 2009-2018;
Private therapy practice in NC: 2009-present%|Volunteer with the Veterinarians for Pets of Homeless Owners in Knoxville||The Rising from the Ashes Oral History Project collects personal accounts of the Chimney Tops II Wildfires of 2016, and The University of Tennessee holds no liability for statements made in the recordings. These accounts reflect the opinions of the narrators, and thus they are subjective and should not be considered verified or comprehensive. Oral history interviews may be used alongside other primary and secondary source materials to gain a fuller understanding of historical events.||
20200423_Martin-West_Stacia||Interview with Stacia Martin-West, 2020-04-23|0:00:22|0:28:00|%Creative Commons Attribution 4.0 International License 
https://creativecommons.org/licenses/by/4.0%||Martin-West, Stacia|||Kaufman, Casey|4/23/2020|Murfreesboro, Tennessee|Nashville, Tennessee|motion pictures (visual works) http://vocab.getty.edu/aat/300136900|Interview with Stacia Martin-West, professor with the College of Social Work at the University of Tennessee. Martin-West discusses her research focused on unconditional cash transfers provided to survivors of the wildfires. She also discusses the perceptions surrounding these transfers. Conducted over Zoom due to the COVID-19 pandemic.|Recovery specialists||Social service|||||||Can you state your name and tell us your role at the university?|0:01:08|What were your general research areas before the wildfires?|0:01:34|When you mention unconditional cash tranfers, does this usually happen after a disaster? Can you talk about when these transfers take place?|0:03:20|Can you tell us about your experiences in the time leading up to the wildfires?|0:05:46|What was your experience like personally and professionally during the fire? What point did you begin thinking about the research opportunity?|0:07:03|How did you go about designing the scope of your research and the methodology?|0:10:13|Can you tell us how the My People Fund was run?|0:13:30|What were some of the other impacts?|0:17:47|Did you see any of the negative connotations to the unconditional cash transfers?|0:18:52|What were some of the other outcomes you found in this study?|0:21:17|After six months, each family received $11,000, did the families see this as having a positive impact?|0:23:53|How do you think this research could affect your discipline's understanding?|0:24:38|After COVID-19, across America, families are receiving unconditional cash transfers, can you talk about the similarities?|0:25:38|Is there anything else we haven't discussed that you would like to mention?|0:27:21|||||||||||||||||||||||||||||||||||||||||||||||||||||||||||||||||||||||||||||||||||||||||||||||||||||||||||||||||||||||||||||||||||||||||||||||||||||||||||||7/17/1986|Knoxville, TN||%B.A. Women's Studies & Philosophy, University of Tennessee Knoxville;
M.S. Social Work, University of Tennessee Knoxville;
PhD Social Welfare, University of Kansas%|Waitress, Veterinary Assistant, Bookstore Manager, Homeless and Domestic Violence Shelter Worker, Research Associate, Assistant Professor of Social Work|Community research on homelessness in Hnoxville, reporductive rights activism, labor activism||The Rising from the Ashes Oral History Project collects personal accounts of the Chimney Tops II Wildfires of 2016, and The University of Tennessee holds no liability for statements made in the recordings. These accounts reflect the opinions of the narrators, and thus they are subjective and should not be considered verified or comprehensive. Oral history interviews may be used alongside other primary and secondary source materials to gain a fuller understanding of historical events.||
20200423_Miller_Andy||Interview with Andy Miller, 2020-04-23|0:00:10|0:31:30|%Creative Commons Attribution 4.0 International License 
