UT Intellectual Unit - YYYYMMDD_Lastname_Firstname|APPL Interview - Original Filename|Title|Interview Start TC|Interview Stop TC|License|Access Note|Narrator Name|Narrator Name 2|Narrator Name 3|Interviewer Name|Date Recorded|Location Recorded|Narrator Location Recorded|AAT Format |Abstract|Narrator Class 1|Narrator Class 2|LCSH_Topic_1|LCSH_Topic_2|LCSH_Topic_3|LCSH_Geo_1|LCSH_Geo_2|LCSH_Name_1|LCSH_Name_2|Interview_Question_1|Interview_Question_1_TC|Interview_Question_2|Interview_Question_2_TC|Interview_Question_3|Interview_Question_3_TC|Interview_Question_4|Interview_Question_4_TC|Interview_Question_5|Interview_Question_5_TC|Interview_Question_6|Interview_Question_6_TC|Interview_Question_7|Interview_Question_7_TC|Interview_Question_8|Interview_Question_8_TC|Interview_Question_9|Interview_Question_9_TC|Interview_Question_10|Interview_Question_10_TC|Interview_Question_11|Interview_Question_11_TC|Interview_Question_12|Interview_Question_12_TC|Interview_Question_13|Interview_Question_13_TC|Interview_Question_14|Interview_Question_14_TC|Interview_Question_15|Interview_Question_15_TC|Interview_Question_16|Interview_Question_16_TC|Interview_Question_17|Interview_Question_17_TC|Interview_Question_18|Interview_Question_18_TC|Interview_Question_19|Interview_Question_19_TC|Interview_Question_20|Interview_Question_20_TC|Interview_Question_21|Interview_Question_21_TC|Interview_Question_22|Interview_Question_22_TC|Interview_Question_23|Interview_Question_23_TC|Interview_Question_24|Interview_Question_24_TC|Interview_Question_25|Interview_Question_25_TC|Interview_Question_26|Interview_Question_26_TC|Interview_Question_27|Interview_Question_27_TC|Interview_Question_28|Interview_Question_28_TC|Interview_Question_29|Interview_Question_29_TC|Interview_Question_30|Interview_Question_30_TC|Interview_Question_31|Interview_Question_31_TC|Interview_Question_32|Interview_Question_32_TC|Interview_Question_33|Interview_Question_33_TC|Interview_Question_34|Interview_Question_34_TC|Interview_Question_35|Interview_Question_35_TC|Interview_Question_36|Interview_Question_36_TC|Interview_Question_37|Interview_Question_37_TC|Interview_Question_38|Interview_Question_38_TC|Interview_Question_39|Interview_Question_39_TC|Interview_Question_40|Interview_Question_40_TC|Interview_Question_41|Interview_Question_41_TC|Interview_Question_42|Interview_Question_42_TC|Interview_Question_43|Interview_Question_43_TC|Interview_Question_44|Interview_Question_44_TC|Interview_Question_45|Interview_Question_45_TC|Interview_Question_46|Interview_Question_46_TC|Interview_Question_47|Interview_Question_47_TC|Interview_Question_48|Interview_Question_48_TC|Interview_Question_49|Interview_Question_49_TC|Interview_Question_50|Interview_Question_50_TC|Interview_Question_51|Interview_Question_51_TC|Interview_Question_52|Interview_Question_52_TC|Interview_Question_53|Interview_Question_53_TC|Interview_Question_54|Interview_Question_54_TC|Interview_Question_55|Interview_Question_55_TC|Interview_Question_56|Interview_Question_56_TC|Interview_Question_57|Interview_Question_57_TC|Interview_Question_58|Interview_Question_58_TC|Interview_Question_59|Interview_Question_59_TC|Interview_Question_60|Interview_Question_60_TC|Interview_Question_61|Interview_Question_61_TC|Interview_Question_62|Interview_Question_62_TC|Interview_Question_63|Interview_Question_63_TC|Interview_Question_64|Interview_Question_64_TC|Interview_Question_65|Interview_Question_65_TC|Interview_Question_66|Interview_Question_66_TC|Interview_Question_67|Interview_Question_67_TC|Interview_Question_68|Interview_Question_68_TC|Interview_Question_69|Interview_Question_69_TC|Interview_Question_70|Interview_Question_70_TC|Interview_Question_71|Interview_Question_71_TC|Interview_Question_72|Interview_Question_72_TC|Chapter_1|Chapter_1_TC|Chapter_2|Chapter_2_TC|Chapter_3|Chapter_3_TC|Chapter_4|Chapter_4_TC|Chapter_5|Chapter_5_TC|Chapter_6|Chapter_6_TC|Chapter_7|Chapter_7_TC|Chapter_8|Chapter_8_TC|Chapter_9|Chapter_9_TC|Chapter_10|Chapter_10_TC|Chapter_11|Quote from Interview|%Location_1
%|Location_1_Coordinates|Location_1_TC|Location_2|Location_2_Coordinates|Location_2_TC|Location_3|Location_3_Coordinates|Location_3_TC|Location_4|Location_4_Coordinates|Location_4_TC|Location_5|Location_5_Coordinates|Location_5_TC|Location_6|Location_6_Coordinates|Location_6_TC|Date of Birth|Birthplace|Length of Time in Gatlinburg/East Tennessee|Education|Occupational Experience|Other Community Involvement|Other Life Info|Disclaimer|Privacy/Defamation concern?|Appearance Release
20190920_James_Zachary||Interview with Zachary James, 2019-09-20|0:00:20|0:18:06|%Creative Commons Attribution 4.0 International License 
https://creativecommons.org/licenses/by/4.0%||James, Zachary|||Romans, Laura|9/20/2019|John C. Hodges Library, University of Tennessee, Knoxville|John C. Hodges Library, University of Tennessee, Knoxville|motion pictures (visual works) http://vocab.getty.edu/aat/300136900|Interview with Zachary James, student at the University of Tennessee Knoxville from Seviereville, Tennessee. James discusses his experience as a high school student in Sevierville during the time of the wildifres, including memories of classmates who were impacted, the closing of Sevier County schools, and the relief efforts.|Individuals (tourists or locals) not directly affected by the fire||Social media|Evacuation of civilians||Sevierville (Tenn.)||||%Could you state your name and where you're from?
%|0:00:48|Can you tell us how long you have lived in Sevierville and what it was like growing up there?|0:01:08|Growing up, did you spend a lot of time going to Gatlinburg?|0:02:03|Could you talk about the week leading up to the fire?|0:02:35|Were you and your friends concerned about the fire? Did that change when the wind started to pick up?|0:03:37|Was your family at any point preparing to evacuate?|0:04:42|You mentioned the news, was that how you were getting your information or were there other ways?|0:06:20|Once the power went out, how were getting updates?|0:07:01|When you started preparing to evacuate, what were you concerned with taking?|0:07:27|So your plan was to evacuate to family in South Carolina? |0:08:14|How did it feel the next couple days? Did it still feel like you might need to evacuate?|0:09:02|What was it like going back to school afterwards?|0:09:55|How did your teachers address the aftermath?|0:11:10|Was it something you and your friends talked about after?|0:12:08|How do you feel the fire has affected or shaped the community?|0:12:42|From a younger person's perspective, how do you feel social media played a role during and after the fire?|0:13:48|Have you and your family talked about provisions in case something like this happens again?|0:14:54|%Is there anything else you would like to add?
%|0:15:35|Could you talk some more about the types of community support you saw?|0:16:38||||||||||||||||||||||||||||||||||||||||||||||||||||||||||||||||||||||||||||||||||||||||||||||||||||||||||||||||||||||||||||||||%"Most of the people who lived in Gatlinburg were like, 'You should come down, see what happened, visit some of the areas that were affected.' Because a lot of these businesses depend on tourists."
%|||||||||||||||||||2/28/2000|Florence, South Carolina|13 years|%High School Graduate;
Undergraduate student, University of Tennessee Knoxville%|Undergraduate Research Assistant|||The Rising from the Ashes Oral History Project collects personal accounts of the Chimney Tops II Wildfires of 2016, and The University of Tennessee holds no liability for statements made in the recordings. These accounts reflect the opinions of the narrators, and thus they are subjective and should not be considered verified or comprehensive. Oral history interviews may be used alongside other primary and secondary source materials to gain a fuller understanding of historical events.||
20190920_Jensen_Russ||Interview with Russ Jensen, 2019-09-20|0:00:01|0:29:15|%Creative Commons Attribution 4.0 International License 
https://creativecommons.org/licenses/by/4.0%||Jensen, Russ|||Wise, Ken|9/20/2019|John C. Hodges Library, University of Tennessee, Knoxville|John C. Hodges Library, University of Tennessee, Knoxville|motion pictures (visual works) http://vocab.getty.edu/aat/300136900|Interview with Russ Jensen, director of 311 and 211 for the city of Knoxville. Jensen discusses initially establishing the channels and awareness in the community for these services. He also recounts the role the organization played during the fire in both directing victims to needed resources as well as the incoming donations and volunteers that needed to be properly funneled into necessary roles.|Public and government officials||Disaster relief|Social service||Knoxville (Tenn.)||||Tell us about how you were involved with the fire through the organization you work with and your role in that.|0:00:30|Could you tell us what the Mountain Tough is?|0:04:26|You're getting calls from people who need assistance and people who want to give assistance?|0:08:57|You mentioned earlier, that people who are calling for assistance would really rather talk to someone on the phone, can you describe why that is the case and what they say when they call?|0:09:43|%How effective for those people who are calling for assistance, was 211?
%|0:11:22|Those people who are wanting to give assistance, can you give some examples of how these people reacted? Were they generous?|0:12:17|Can you tell us about where the warehouse was?|0:14:11|Was the warehouse in Gatlinburg?|0:15:18|What would you do in the future, what changes would you make?|0:15:35|How was this fire different from the other disasters you've encountered?|0:17:21|Was the disaster result from this fire greater than others you've seen?|0:19:00|Do you have any other observations about 211 or the fire that you would like to share?|0:19:53|When the calls first started coming in, was there any sense of the chaos going on in Gatlinburg?|0:23:00|Have you had anybody in the past 3 years call you about the assistance 211 gave them?|0:24:20|How many people in Gatlinburg were unaware of 211 before the fire?|0:26:36|%Are there any other concluding comments you would like to make?
%|0:27:35||||||||||||||||||||||||||||||||||||||||||||||||||||||||||||||||||||||||||||||||||||||||||||||||||||||||||||||||||||||||||||||||||||||"A lot of times people, especially when you're dealing in a crisis, you don't want to be on the internet searcing for stuff, you want to talk to somebody."|||||||||||||||||||7/10/1959|Alhambra, California|20 years|B.S. Psychology, UCLA|%Paramedic, Los Angeles County: 1990-1997;
EMS and Fire Services Director, Knox County;
EMS Director, Communicatial, Operations, Government Relations Director 311/211%|Numbers ND Boards, UWGK |Governors Disaster Planning Group, AIREX 1996 (LAX), Governors Customer Focused Government Group, TN|The Rising from the Ashes Oral History Project collects personal accounts of the Chimney Tops II Wildfires of 2016, and The University of Tennessee holds no liability for statements made in the recordings. These accounts reflect the opinions of the narrators, and thus they are subjective and should not be considered verified or comprehensive. Oral history interviews may be used alongside other primary and secondary source materials to gain a fuller understanding of historical events.||
20190920_Whaley_Seemona-Daniel||Interview with Seemona and Daniel Whaley, 2019-09-20|0:00:32|0:57:34|%Creative Commons Attribution 4.0 International License 
https://creativecommons.org/licenses/by/4.0%||Whaley, Seemona|Whaley, Daniel||Kaufman, Casey|9/20/2019|John C. Hodges Library, University of Tennessee, Knoxville|John C. Hodges Library, University of Tennessee, Knoxville|motion pictures (visual works) http://vocab.getty.edu/aat/300136900|Interview with Seemona and Daniel Whaley, former residents of Gatlinburg. The Whaley's discuss the feeling at the time before the fire had become widespread. They also go into detail about the harrowing efforts to evacuate off a mountain that wass engulfed in the fire. Reflections about community relations and how Gatlinburg began to slowly recover are also touched upon.|Individuals (tourists or locals) directly affected by the fire||Teachers|Evacuation of civilians||||||Can you state your names and tell us about your history in Gatlinburg?|0:01:27|Can you tell us about your occupation in Gatlinburg?|0:03:24|Can you tell us about your other roles in the community in Gatlinburg?|0:05:00|Can you recall anything about the days leading up to the fire?|0:06:20|At what point did you become concerned?|0:08:35|So you took your son to the high school?|0:10:39|This was in the afternoon?|0:11:01|When you were at the school, what was the general feeling?|0:11:44|After you went back home, can you tell me about what transpired that evening?|0:12:51|How did you feel at that point in the evacuation?|0:21:16|You hadn't even made it through the path of the fire yet?|0:28:41|So where do you evacuate to?|0:29:53|When you get to your mother's house, what are you thinking?|0:32:17|%You returned to Gatlinburg after 3 days?
%|0:33:41|Where did you go after leaving your mother's house?|0:36:38|How did you start that first day back at school? What was is like bringing all the kids back together?|0:44:30|Can you tell me about the decision to move after the fire?|0:46:04|How has this experience affected you emotionally, both as a family and an individual?|0:48:18|Have you thought about making any provisions in case an emergency happens again?|0:52:30|Is there anything else that you would like to add?|0:57:15||||||||||||||||||||||||||||||||||||||||||||||||||||||||||||||||||||||||||||||||||||||||||||||||||||||||||||||||||||||||||||||"That's where it looked like lava running up the mountain. You could see the fire going uphill."|Chalet Village North, Gatlinburg, TN|35.7232049, -83.5277175|00:12:50 - 00:26:45|Pi Beta Phi Elementary|35.7117, -83.5121015|00:09:18 - 0012:50|The Spur (US-321/US 441 S)|35.744143, -83.520302|00:28:18 - 00:32:16|||||||||||||||||The Rising from the Ashes Oral History Project collects personal accounts of the Chimney Tops II Wildfires of 2016, and The University of Tennessee holds no liability for statements made in the recordings. These accounts reflect the opinions of the narrators, and thus they are subjective and should not be considered verified or comprehensive. Oral history interviews may be used alongside other primary and secondary source materials to gain a fuller understanding of historical events.||
20191013_Shambaugh_Frances_Fox||Interview with Frances Fox Shambaugh, 2019-10-13|0:00:04|0:39:13|%Creative Commons Attribution 4.0 International License 
https://creativecommons.org/licenses/by/4.0%||Fox Shambaugh, Frances|||Wise, Ken|10/13/2019|Park Vista Hotel, Gatlinburg, Tennessee|Park Vista Hotel, Gatlinburg, Tennessee|motion pictures (visual works) http://vocab.getty.edu/aat/300136900|Interview with Frances Shambaugh, lifelong resident of Gatlinburg. Shambaugh recounts her evacuation and time spent afterwards at the community center. She discusses the efforts in the community to support one another and her own efforts at rebuilding her home and studio.|Individuals/families suffering losses||Emergency housing|Evacuation of civilians||Arrowmont School of Arts and Crafts||||%Could you state your name and a little about how long you've been in Gatlinburg?
%|0:00:51|Can you tell us about what you've been doing in Gatlinburg since moving back?|0:01:19|Where were you when you first became aware of the fire in the park?|0:02:30|After getting to the community center, what were your thoughts?|0:06:00|When did you first learn about the fire reaching your house?|0:06:22|What was your feeling when you learned you had lost your house?|0:07:15|When you couldn't go back home, what did you do?|0:07:45|How long did you stay in the shelter?|0:08:50|What kind of activities were you doing during that time?|0:09:12|At what point did you get back to see your home?|0:10:55|What was your reaction seeing your home destroyed?|0:11:18|How long did you stay there that first day?|0:12:19|What was your thinking process at this point?|0:13:38|%Did you talk with your neighbors about the loss?
%|0:14:40|Being in the rental house had a creepy feeling?|0:15:31|Did you ever get back into regular Arrowmont programming during this time?|0:18:28|Can you describe the sense of community that was at Arrowmont?|0:19:04|At what point did you start thinking about your business?|0:20:18|Did the community come together and share a studio?|0:21:42|After reestablishing your business, what did you do about your home?|0:22:35|Did you have any difficulties contacting friends and family during the fire?|0:23:29|At any point in the fire did you feel that you were in danger?|0:24:11|How did this event impact you emotionally?|0:25:17|How did this impact you financially?|0:26:23|Have you managed to recover your business?|0:27:36|Have you made any provisions in case this happens again?|0:28:00|Did you build your house back similar?|0:29:20|How did the fire shape community relations?|0:31:16|%Did anything surprising or good that came out of this?
%|0:33:25|What effect did the media coverage have?|0:34:45|Is there anything else that you would like to share?|0:35:38|Was the outpouring in the community what you expected?|0:36:28||||||||||||||||||||||||||||||||||||||||||||||||||||||||||||||||||||||||||||||||||||||||||||||||||||||%"It brough people together and there was a strong sense of community. A strong sense of not only us helping each other, but people all over the country helping us."
%|Rattlesnake Hollow Road, Gatlinburg, TN|35.7189965, -83.4973744|00:02:07 - 00:04:19, 00:10:57 - 00:13:29|Pigeon Forge Community Center|35.8062593, -83.5847141|00:04:19 - 00:10:58|Arrowmont School of Arts and Crafts|35.712925, -83.5104784|00:18:33 - 00:20:17||||||||||11/25/1939|Barbourville, Kentucky|Lifelong resident|%B.A. History & Religion;
M.A. Religious Studies;
30 Credit hours Eucation (grad level);
30 Art Credits, University of Tennessee%|Studio Artist, Weaving assistant in Cottage Weavin, Program Arrowcraft Shop|Chamber of Commerce Board, A&C Community Board, Chair of Bicentener Com.||The Rising from the Ashes Oral History Project collects personal accounts of the Chimney Tops II Wildfires of 2016, and The University of Tennessee holds no liability for statements made in the recordings. These accounts reflect the opinions of the narrators, and thus they are subjective and should not be considered verified or comprehensive. Oral history interviews may be used alongside other primary and secondary source materials to gain a fuller understanding of historical events.||
20191013_Wellborn_Paul||Interview with Paul Wellborn, 2019-10-13|%audio: 00:00:00
video: 00:00:40%|0:37:45|%Creative Commons Attribution 4.0 International License 
https://creativecommons.org/licenses/by/4.0%||Wellborn, Paul|||Kaufman, Casey|10/13/2019|Park Vista Hotel, Gatlinburg, Tennessee|Park Vista Hotel, Gatlinburg, Tennessee|motion pictures (visual works) http://vocab.getty.edu/aat/300136900|Interview with Paul Wellborn, owner of Ely's Mill in Gatlinburg. Wellborn recounts his efforts during the fire to help direct traffic out of the town. He also discusses the following days and weeks dealing with city and federal responders to the crisis.|Business owners and staff||Emergency management|Evacuation of civilians||||||Can you tell us about your life in Gatlinburg?|0:00:48|Can you tell us about Ely's Mill?|0:01:42|Can you tell us about your current life in Gatlinburg?|0:02:48|When did you retire from working for the city?|0:04:55|Can you tell us about the days leading up to the fire?|0:05:25|Had you heard anything about needing to evacuate?|0:07:49|Are most of the people trying to evacuate locals or tourists?|0:09:50|What was the general feeling of the people evacuating that night?|0:10:54|What were you feeling that night?|0:11:12|Were there other people helping in the evacuation?|0:12:46|Were you able to communicate with your phone at the time?|0:13:35|What was it like at Rocky Top Sports World that night?|0:14:29|%Could you talk about the fire department using Ely's Mill as a staging area?
%|0:20:05|The Department of Homeland Security were looking for bodies?|0:22:09|How would you assess the recovery efforts?|0:23:08|How did you feel about all the agencies coming into town?|0:25:18|How do you think the fire has shaped the community in these three years?|0:27:37|Is there anything you would like to add about how the fire affected Gatlinburg?|0:30:09|Do the people who come in now have any sense of what happened three years ago?|0:31:06|You feel like there are more deaths than what was reported?|0:32:10|Have you made any provisions if this happens again? Is the city better prepared?|0:32:51|Was there anything surprising or good that came out of the fire?|0:33:30|Did you see any of the rebuilding in the city?|0:35:05|Are there any places that have burned that you still miss?|0:35:32|Would you have moved if you had lost the mill?|0:36:21|Is there anything else that you would like to add?|0:37:21||||||||||||||||||||||||||||||||||||||||||||||||||||||||||||||||||||||||||||||||||||||||||||||||||||||||||||||||||"The smoke got so bad, he was having to look at the lines to see where to go. He was looking at the line in the road on that backhoe to get out of there."|Ely's Mill, Gatlinburg, TN|35.7161077, -83.4881917|00:00:00- 00:08:46|Low Gap Road, Gatlinburg, TN|35.7221239, -83.4831102|00:08:46 - 00:11:54|||||||||||||||since 1984||Air Force, Federal Express, Mechanic for the City of Gatlinburg, Ely's Mill|Board of Directors Sportman's Club|%
%|The Rising from the Ashes Oral History Project collects personal accounts of the Chimney Tops II Wildfires of 2016, and The University of Tennessee holds no liability for statements made in the recordings. These accounts reflect the opinions of the narrators, and thus they are subjective and should not be considered verified or comprehensive. Oral history interviews may be used alongside other primary and secondary source materials to gain a fuller understanding of historical events.||
20191013_Wellborn_Ruth||Interview with Ruth Wellborn, 2019-10-13|0:00:03|0:34:11|%Creative Commons Attribution 4.0 International License 
https://creativecommons.org/licenses/by/4.0%||Wellborn, Ruth|||Romans, Laura|10/13/2019|Park Vista Hotel, Gatlinburg, Tennessee|Park Vista Hotel, Gatlinburg, Tennessee|motion pictures (visual works) http://vocab.getty.edu/aat/300136900|Interview with Ruth Wellborn, owner of Ely's Mill in Gatlinburg. Wellborn was in the Florida Keys during the day of the fire, and recounts her experience returning home after the disaster. She discusses personal recovery efforts as well as those by the city. She also discusses the feeling of a town that has to rebuild after a wildfire of this magnitude.|Business owners and staff||Tourism|||||||Can you tell us how long you have lived in Gatlinburg?|0:00:48|Can you tell us about your life in Gatlinburg?|0:01:17|Can you describe your home and the part of town it is in?|0:04:18|Can you talk about the days leading up to the fire?|0:06:55|So you were on a trip in Florida when you started hearing from people in Gatlinburg?|0:08:20|Were you able to communicate with anyone on your way back to Gatlinburg?|0:16:31|How do you feel social media played a role?|0:18:12|%Was the smoke different when you got back than when you left?
%|0:19:43|Can you talk about the responders using the mill as a staging area?|0:23:30|Can you talk about how the fire impacted your land?|0:24:53|Do you see the trend of people steadily returning continuing?|0:27:07|How did this event affect you emotionally?|0:28:42|Have you made any provisions in case something like this happens again?|0:30:45|Do you feel that anything surprising or good came out of the fire?|0:31:58||%
%||||||||||||||||||||||||||||||||||||||||||||||||||||||||||||||||||||||||||||||||||||||||||||||||||||||||||||||||||||||||||||||||||||||||"I contend that, you know, I had lots and lots of angels. You can say the power of positive thinking or whatever, but my official line is that I had angels."|Ely's Mill, Gatlinburg, TN|35.7161077, -83.4881917|00:00:00 - 00:06:50|Low Gap Road, Gatlinburg, TN|35.7221239, -83.4831102|00:13:38 - 00:14:35|||||||||||||||since early 1970s|Bachelors of Zoology/Animal Science, UTK|Animal Shelter/Vet Clinic, Ely's Mill|Karate Dojos, Farmer's Market, Library|Ely's Mill is a historical store/mill/area showcasing local craftspeople and mountain heritage. Family land since 1925.|The Rising from the Ashes Oral History Project collects personal accounts of the Chimney Tops II Wildfires of 2016, and The University of Tennessee holds no liability for statements made in the recordings. These accounts reflect the opinions of the narrators, and thus they are subjective and should not be considered verified or comprehensive. Oral history interviews may be used alongside other primary and secondary source materials to gain a fuller understanding of historical events.||
20191013_Wise_Ken||%
Interview with Ken Wise, 2019-10-13%|0:00:02|0:28:05|%Creative Commons Attribution 4.0 International License 
