%|0:02:02|How long have you been a volunteer with the Red Cross?|0:02:55|Tell me about what was going on with you leading into the fire?|0:03:26|So you went in before they called you? Did you go in at Knoxville or Gatlinburg?|0:04:50|What day did you come into Knoxville, the day of the fire, or during the days leading up to it?|0:05:14|What was the first thing you saw when you got there? Tell us about what you did after intitially arriving.|0:06:02|Did you talk to any people on that visit or was it just observation?|0:07:28|What did some of the people share with you that day?|0:07:42|How much awareness did they, or you, have of what was going on?|0:08:20|Tell us what a command center is like.|0:09:47|Was your job to assess the situation and connect jpeople with mental health services?|0:11:10|%Did that help you get your job done since the Dolly Foundation was providing resources?
%|0:13:33|After you assessed the shelters, what was the next step for you? Did you go out into the community at all?|0:14:11|Did you feel like you had enough help on the mental health side?|0:15:57|Did it feel like the people in these facilities were reaching out to you? What was their reaction?|0:16:59|Are there stories, excluding specific clients, that stood out to you?|0:18:07|How long were you up there?|0:22:24|How does this compare to other events you've been part of?|0:22:33|%Did you also work with the firefighters and first responders?
%|0:24:15|Have you been back to Gatlinburg since you left?|0:25:31|What were the lessons learned?|0:26:33|What did your heart take away from this?|0:28:28|Does it feel like you've helped your home?|0:29:19|Are you still hiking?|0:30:04|Is there anything else you wanted to share that I haven't asked?|0:30:11||||||||||||||||||||||||||||||||||||||||||||||||||||||||||||||||||||||||||||||||||||||||||||||||||||||||||||||||||"You can't make this kind of thing better. There's nothing you can do to fix it or make it better. To me, the only thing you can do, is not make it worse."|Kodak, TN|35.97453, -83.62684|||||||||||||||||10/23/1947|Knoxville, TN||%B.S. Education;
M.S. Social Work%|Clinical social work|Red Cross volunteer||The Rising from the Ashes Oral History Project collects personal accounts of the Chimney Tops II Wildfires of 2016, and The University of Tennessee holds no liability for statements made in the recordings. These accounts reflect the opinions of the narrators, and thus they are subjective and should not be considered verified or comprehensive. Oral history interviews may be used alongside other primary and secondary source materials to gain a fuller understanding of historical events.||
20200110_Hubert_Mali||Interview with Mali Hubert, 2020-01-10|0:00:02|0:24:21|%Creative Commons Attribution 4.0 International License 
https://creativecommons.org/licenses/by/4.0%||Hubert, Malie|||Wise, Ken|1/10/2020|John C. Hodges Library, University of Tennessee, Knoxville|John C. Hodges Library, University of Tennessee, Knoxville|motion pictures (visual works) http://vocab.getty.edu/aat/300136900|Interview with Malie Hubert, PhD candidate with the Ecology and Evolutionary Biology department of UT. Hubert discusses her study of the resurgence in plant species after the fire in both natural and urban environments.|Fire and forestry experts||Forest fires--Environmental aspects|Forest regeneration|Plants--Effect of fires on|Great Smoky Mountains National Park (N.C. and Tenn.)||||%Can you state your name and tell us about how you came to Knoxville?
%|0:00:40|Which department are you in for graduate school?|0:01:10|Can you tell us about the general interest of your research?|0:01:23|So your initial interest was invasive species after the wildfires?|0:02:03|Can you tell us a little about when you first heard about this fire?|0:02:26|So you and your advisor both saw this as an opportunity?|0:03:22|So you had no immediate experience with the fire?|0:03:40|Had you visited Gatlinburg before?|0:04:00|Can you tell us about the conversations with your colleagues and advisor about the opportunity?|0:04:10|How did you focus your research on the fire and invasive species?|0:05:12|Can you tell us about the first time you went to Gatlinburg after the fire?|0:06:11|Where did you go on that initial visit?|0:07:05|Did yo go other places?|0:07:31|%To help visualize the difference between the two kinds of sites, were all the sites affected by the same fire?
%|0:07:57|So what are you looking for at sites in natural areas versus ones in urban environments?|0:08:33|What is your hypothesis, or what are you hoping to discover with this research?|0:09:34|What were the distinctions between the three levels of severity in the natural site?|0:10:24|What plant species were you looking at?|0:10:45|Can you compare that with what you found in the urban sites?|0:11:56|Did the greater amount of diversity in the urban sites surprise you?|0:12:20|What was your reaction when you realized that your intial hypothesis was wrong?|0:12:41|Is your research project still continuing?|0:13:25|How did your focus on invasive species play into this research?|0:14:13|How would ou say that your research expanded our understanding of this jparticular event?|0:14:44|Are you seeing invasive species taking advantage of this fire?|0:15:51|So the natural species are holding their own? Are they all coming back or just specific ones?|0:16:12|When you picked your sites, was it limited to specific species or areas?|0:16:49|How can this research be built on going forward?|0:17:46|What would be the impact of this research on the public?|0:18:28|Will this fire happen again?|0:19:16|Did anything good come out of this from an ecological perspective?|0:19:54|In the wider context of the research, what should we as th epublic understand?|0:20:33|Now that it's been three years, what is your response when you see the forest?|0:21:07|Is there anything else that you would like to share about your experience?|0:21:58|These people whose land you may be surveyng in Gatlinburg, did any of them lose property or houses?|0:23:03|Anything else you would like to share?|0:23:44||||||||||||||||||||||||||||||||||||||||||||||||||||||||||||||||||||||||||||||||||||||||||||||"If and when this does happen again, I think it's important to know what type of plants are we gonna see coming about. Are we seeing more fire adapted species? Are we seeing the same species that we already there?"|||||||||||||||||||3/29/1994|Pittsburgh, PA||%B.S. Biology, Penn State University, 2016;
Ph.D. Ecology & Evolutionary Biology, University of Tennessee (in progress) %|Internships with PA Department of Agriculture, PA Department of Conservation & Natural Resources|TN Achieves Mentor, Darwin Day Coordinator (2018), Kids U Instructor, EEB UG mentoring programs||The Rising from the Ashes Oral History Project collects personal accounts of the Chimney Tops II Wildfires of 2016, and The University of Tennessee holds no liability for statements made in the recordings. These accounts reflect the opinions of the narrators, and thus they are subjective and should not be considered verified or comprehensive. Oral history interviews may be used alongside other primary and secondary source materials to gain a fuller understanding of historical events.||
20200111_Day_Fran||Interview with Fran Day, 2020-01-11|0:00:05|0:54:26|%Creative Commons Attribution 4.0 International License 
https://creativecommons.org/licenses/by/4.0%||Day, Fran|||Kaufman, Casey|1/11/2020|Park Vista Hotel, Gatlinburg, Tennessee|Park Vista Hotel, Gatlinburg, Tennessee|motion pictures (visual works) http://vocab.getty.edu/aat/300136900|Interview with Fran Day of Arrowmont School of Arts and Crafts. Day provides a history of the school in the area and its role in the community. She then discusses her experience leading up to and during the fire. She also talks about how Arrowmont was active in the community following the wildfires.|Individuals (tourists or locals) directly affected by the fire||Evacuation of civilians|||Arrowmont School of Arts and Crafts||||%Can you state your name and tell us a little about yourself?
%|0:00:40|Can you tell me a little about the Arrowmont School of Arts and Crafts?|0:01:51|Can you tell me about the Arrowmont School as it exists today in the community?|0:09:51|Tell me about how Arrowmont is situated in what is very much an arts community.|0:12:47|Can you tell us about the days and weeks leading up to the 2016 wildfires?|0:15:00|About what time of day is this that you're setting up for Souper Bowl?|0:17:46|What part of town did you live in?|0:19:00|It sounds like you were composed while making these decisions, what were you feeling at this point?|0:25:02|Was your husband at the Rocky Top community center?|0:26:42|Do you remember what news station initially reported that Arrowmont had burned?|0:30:32|When you met with your colleagues again, did they know if their homes had survived or not?|0:32:46|What was it like going into Gatlinburg for the first time after the fire?|0:33:54|Have you noticed an emotional toll that the event has had on you?|0:46:36|From your anthropological perspective, can you talk about the human element during this event?|0:48:01|Do you think that this could happen again in East Tennessee?|0:49:29|Is there anything else good that came out of this disaster?|0:50:17|Can you share with us the value of sharing your story an dpreserving it?|0:51:50|What do you think the lessons learned are?|0:53:05||||||||||||||||||||||||||||||||||||||||||||||||||||||||||||||||||||||||||||||||||||||||||||||||||||||||||||||||||||||||||||||||||"There's some tenets in our culture: you never take without giving back, you have a certain responsibility to your neighbor, you don't whine, you don't what you can when you can, and you just deal with whatever comes."|Arrowmont School of Arts and Crafts|35.712925, -83.5104784|%00:15:00 - 00:18:55 (and throughout)
%|Beech Branch Road, Gatlinburg, TN|35.739605, -83.5124498 |00:19:00 - 00:24:12|The Spur (US-321/US 441 S)|35.744143, -83.520302|00:24:12 - 00:27:08||||||||||11/29/0194|Gulfport, MS||%Management Engineering, UCLA; 
Anthropology, University without Walls;
Anthropology - Appalachian studies, University of Tennessee%|Fundraising, nonprofit management, university professor, broadcaster|Serve on Board of Four Directions Economic Developent Corporation||The Rising from the Ashes Oral History Project collects personal accounts of the Chimney Tops II Wildfires of 2016, and The University of Tennessee holds no liability for statements made in the recordings. These accounts reflect the opinions of the narrators, and thus they are subjective and should not be considered verified or comprehensive. Oral history interviews may be used alongside other primary and secondary source materials to gain a fuller understanding of historical events.||
20200111_Lane_Joy||Interview with Joy Lane, 2020-01-11|0:00:13|0:28:58|%Creative Commons Attribution 4.0 International License 
https://creativecommons.org/licenses/by/4.0%||Lane, Joy|||Wise, Ken|1/11/2020|Park Vista Hotel, Gatlinburg, Tennessee|Park Vista Hotel, Gatlinburg, Tennessee|motion pictures (visual works) http://vocab.getty.edu/aat/300136900|Interview with Joy Lane, resident and native of Sevierville. Lane shares her story of being forced to evacuate her home during the 2016 wildfires. She also discusses returning to find her home destroyed and the difficulties she faced in the period afterwards.|Individuals/families suffering losses||Evacuation of civilians|||||||Can you tell us your name and how long you have been in Gatlinburg?|0:00:50|Does all of your family live in Gatlinburg?|0:01:37|Where were you living at the time of the fire?|0:01:58|When did you first get news that there was a fire in the Smokies?|0:02:10|Did you work in Gatlinburg?|0:02:34|What time did you leave work to go home?|0:02:49|Was your husband at home?|0:03:33|Did you know that Gatlinburg was on fire at that time?|0:04:00|What time of day did you start evacuating?|0:04:29|Did your neighbors leave with you?|0:06:34|Could you get back to your home yet? What did you do next?|0:06:50|How did you react when you first heard your house had burned down?|0:07:37|How did your husband react to the loss?|0:08:13|Did you talk to your neighbors afterwards?|0:08:42|After hearing that you had lost everything, what did you do next?|0:09:16|What did you see when you came back to your home?|0:09:47|Was anyone else in your family involved?|0:10:16|What was your son's reaction?|0:10:30|What did you do over the next few days?|0:11:06|What did picking up the pieces look like?|0:11:35|How difficult was it for you to work through this process?|0:12:05|Did they ever determine what cause the fire? Was it a transformer?|0:13:20|Can you tell us about the emotional impact that the fire had on you?|0:13:47|Can you talk about the financial impact that this had?|0:14:30|Were you able to go back to work fairly soon?|0:15:30|Was your husband's work affected by the fire any?|0:15:58|What was the next step?|0:16:13|How do you think these fires shaped community relations?|0:17:07|What are some examples?|0:17:28|What provisions have th epeople in Pigeon Forge and Gatlinburg made for the future? Have you made any personally?|0:18:08|Do you think another fire can happen here?|0:18:50|Have you encountered anybody in the community that blames the city for what happened?|0:19:30|Do you think they took care of you the best that they could?|0:20:12|Did anything surprising or good come out of this?|0:20:20|Did the kindness you received from the community surprise you?|0:21:39|Did any of your friends that you grew up with lose their homes?|0:22:10|How would you assess the overall recovery effort of Gatlinburg after the fire?|0:22:44|Is there anything else that you would like to add?|0:23:38|Can you describe the fire you saw in the video?|0:24:44|How many days after the fire did you see this video?|0:24:44|What was going through your mind while watching it?|0:25:45|Did you ever watch it again?|0:26:03|Is there anything else you would like to add?|0:26:12|What was it like going through the rubble of your home?|0:26:56||||||||||||||||||||||||||||||||||||||||||||||||||||||||||||||||||||||||||||||"We were just focused on grabbing the pet and what few belongings I packed to get out of there cause we didn't know how soon the embers would catch the house on fire."|Pigeon Forge||00:02:10 - 00:05:20|Middle Creek Road, Sevierville, TN||00:05:20 - 00:06:34|||||||||||||5/4/1965|Maryville, TN||High School|Child Care Teacher|||The Rising from the Ashes Oral History Project collects personal accounts of the Chimney Tops II Wildfires of 2016, and The University of Tennessee holds no liability for statements made in the recordings. These accounts reflect the opinions of the narrators, and thus they are subjective and should not be considered verified or comprehensive. Oral history interviews may be used alongside other primary and secondary source materials to gain a fuller understanding of historical events.||
20200111_May_Anne||Interview with Anne May, 2020-01-11|0:00:02|0:55:25|%Creative Commons Attribution 4.0 International License 
https://creativecommons.org/licenses/by/4.0%||May, Anne|||Kaufman, Casey|1/11/2020|Park Vista Hotel, Gatlinburg, Tennessee|Park Vista Hotel, Gatlinburg, Tennessee|motion pictures (visual works) http://vocab.getty.edu/aat/300136900|Interview with Anne May of Arrowmont School of Arts and Crafts. May provides a background for the school before discussing the events of the fire. She recounts helping the artists in residence to evacuate from the campus before evacuating from the town herself. She then tells about the community involvement Arrowmont had in Gatlinburg during the recovery period.|Business owners and staff||Evacuation of civilians|||Arrowmont School of Arts and Crafts||||Can you state your name and tell us about yourself?|0:00:36|Tell me about your work at Arrowmont.|0:01:35|Will you tell us about the Arrowmont School of Arts and Crafts?|0:02:12|Can you tell us about the Artist in Residence program?|0:03:34|What is Arrowmon't situation within Gatlinburg?|0:04:41|Is there any other community involvement that you would like to share?|0:05:50|Tell us about the weeks and days leading to the wildfires?|0:06:48|Leading up to the fires, were people talking about this becoming something potentially worse?|0:08:17|At what point did you become concerned?|0:09:11|When people were bringing their artwork to Arrowmont, did you hear them talking about what they had seen?|0:12:19|What time is it after the artists in residence were evacuated?|0:12:58|What did you see when evacuating?|0:13:31|What were you thinking on the drive home? Were you alone?|0:14:14|Once you got home, what were your next actions?|0:15:54|Once you got home, what were your next actions?|0:15:54|Did you know what was going on at Arrowmont?|0:17:36|When you left your home, where did you go?|0:19:10|When you get to Knoxville, what happens then?|0:19:51|So you were still able to call Bill (husband) through the night?|0:20:42|Had you been watching the news?|0:21:54|How did social media play a role that evening?|0:22:29|Did you hear from anyone that had lost their home?|0:23:21|When did you learn that Arrowmont had survived?|0:24:28|Can you tell me about the first time you went back into Gatlinburg?|0:26:33|Can you describe what it was like seeing the devastation?|0:28:04|When did Arrowmont bring the staff back together? What were those days like when you all came together after the fire?|0:29:54|Were you having conversations with the donors at the time?|0:31:31|Do you remember if any of the volunteers at Arrowmont had lost their homes?|0:32:38|What are some ways that Arrowmont supported the community after the fire?|0:34:45|Were there any memorable stories from that time that you would like to share?|0:37:30|Can you tell us about the event on Christmas at Arrowmont?|0:39:20|Can you tell me about the recovery efforts in Gatlinburg?|0:41:06|How has the wildfire impacted you emotionally?|0:43:38|How do you feel the fires shaped community relations?|0:45:30|Can you share your thoughts on the phrase "Mountain Tough" that came out of the fire?|0:47:01|Do you feel that this event could happen again? Is Gatlinburg prepared if that were to happen?|0:49:14|Was there anything else surprising or good that came out of this?|0:51:30|Could you tell us what the value in preserving this event is?|0:53:18|Is there anything else that we haven't talked about that you would like to share?|0:55:05||||||||||||||||||||||||||||||||||||||||||||||||||||||||||||||||||||||||||||||||||||||||"There were people out there that their interest was knowing that in order for Gatlinburg to come back, people were gonna have to be very purposeful in how they contributed to that effort."|Arrowmont School of Arts and Crafts|35.712925, -83.5104784|00:09:24 - 00:13:22||||||||||||||||9/12/1964|Knoxville, TN||%B.M. Piano Pedagogy;
M.M. Piano Pedagogy%|Self-employed piano teacher 1982 - present, Arrowmont School of Arts and Crafts October 2014 - present|||The Rising from the Ashes Oral History Project collects personal accounts of the Chimney Tops II Wildfires of 2016, and The University of Tennessee holds no liability for statements made in the recordings. These accounts reflect the opinions of the narrators, and thus they are subjective and should not be considered verified or comprehensive. Oral history interviews may be used alongside other primary and secondary source materials to gain a fuller understanding of historical events.||
20200111_Myers_Carol||Interview with Carol Myers, 2020-01-11|0:00:03|0:36:06|%Creative Commons Attribution 4.0 International License 
https://creativecommons.org/licenses/by/4.0%||Myers, Carol|||Kaufman, Casey|1/11/2020|Park Vista Hotel, Gatlinburg, Tennessee|Park Vista Hotel, Gatlinburg, Tennessee|motion pictures (visual works) http://vocab.getty.edu/aat/300136900|Interview with Carol Myers of Pi Beta Phi Elementary School. Myers discusses the morning of the fire with regards to the feelings inside the school among faculty and students. She also talks about the challenges faced by her husband an officer with the Gatlinburg Police Department; as well as the difficulties shared by students during the fire and after.|Individuals (tourists or locals) directly affected by the fire||Teachers|Emergency management|Evacuation of civilians|Pittman Center (Tenn.)||||Can you state your name and tell us a little about yourself?|0:00:33|Can you tell us a little about the Pi Beta Phi Elementary School?|0:01:11|Talking about the transient community, can you tell us about the diversity at the school?|0:03:13|It sounds like the teacher community is also close knit?|0:04:42|What do you do at the school?|0:05:02|Before talking about the day of the fire, what do you remember about the weeks before it?|0:05:34|Tell me about the day of the fire.|0:06:15|What time did you leave that day? Were the students still at the school?|0:07:22|Were you with family in Sevierville?|0:08:39|What news station was set up at the intersection?|0:10:11|So you didn't consider evacuating?|0:12:20|When your husband came home, did you two talk?|0:14:52|Did Chris lose his house?|0:17:09|In the days after the fire, can you talk about the experience of returning to Pi Beta Phi?|0:17:40|Were there any stories that stood out from the students sharing?|0:20:06|Did you receive a lot of cards from other children?|0:23:20|You mentioned some of your coworkers had lost everything, but they were still teaching?|0:24:17|Did you have any children that didn't return in your class?|0:24:38|How was the news broken about the two students that lost their lives?|0:25:17|Did your husband share any thoughts about going back to the police fore after the fire?|0:26:05|The first time that you went back into Gatlinburg, what was that like?|0:26:47|Is there anything more you would like to share about the days and weeks after the wildfire?|0:28:02|Did you feel that Gatlinburg would reestablish itself after the fire?|0:28:54|Do you feel that people are coming into Gatlinburg now without knowing about the fire?|0:30:58|Can you tell me about your assessment of Gatlinburg in these past 3 years?|0:31:28|How do you feel the fires shaped community relations?|0:32:03|How do you feel about the phrase "Mountain Tough" and how it characterizes the community?|0:32:35|Do you feel that this could happen again and have you made any provisions? Has the City?|0:33:17|Do you feel there was anything good that came out of this fire?|0:34:32|Can you share with us any value you see in preserving these stories for the future?|0:35:19|Is there anything  we haven't talked about that you would like to share?|0:35:58|||||||||||||||||||||||||||||||||||||||||||||||||||||||||||||||||||||||||||||||||||CUT|00:09:40 - 00:09:55||||||||||||||||||||"[The fire] would leave buildings perfectly fine, standing, but the building next to it would be burned to the ground. Something would be singed, but something else would be burned."|Pi Beta Phi Elementary School|35.7117, -83.5121015|00:06:15 - 00:08:16|Sevierville, TN||00:08:28 - 00:09:12|||||||||||||6/6/1960|Rockwood, TN|37+ years|%A.S. Roane State Community College, Harriman, TN;
Additional college courses%|Instructional paraprofessional; currently: library assistant|Little Free Library Steward||The Rising from the Ashes Oral History Project collects personal accounts of the Chimney Tops II Wildfires of 2016, and The University of Tennessee holds no liability for statements made in the recordings. These accounts reflect the opinions of the narrators, and thus they are subjective and should not be considered verified or comprehensive. Oral history interviews may be used alongside other primary and secondary source materials to gain a fuller understanding of historical events.||
20200111_Oakley_Lisa-Hannah||Interview with Lisa and Hannah Oakley, 2020-01-11|0:00:10|1:02:50|%Creative Commons Attribution 4.0 International License 
