High School Basketball Coach%|Samaritan's Purse Volunteer||The Rising from the Ashes Oral History Project collects personal accounts of the Chimney Tops II Wildfires of 2016, and The University of Tennessee holds no liability for statements made in the recordings. These accounts reflect the opinions of the narrators, and thus they are subjective and should not be considered verified or comprehensive. Oral history interviews may be used alongside other primary and secondary source materials to gain a fuller understanding of historical events.||
20200612_Moerman_Jessica||Interview with Jessica Moerman, 2020-06-12|0:00:53|0:47:18|%Creative Commons Attribution 4.0 International License 
https://creativecommons.org/licenses/by/4.0%||Moerman, Jessica|||Kaufman, Casey|6/12/2020|Murfreesboro, Tennessee|Washington, D.C.|motion pictures (visual works) http://vocab.getty.edu/aat/300136900|Video interview with Dr. Jessica Moerman conducted by Casey Kaufman. Moerman discusses the loss of her family cabin in Gatlinburg, and then outlines the effects of climate change that are impacting the community and leading to these disasters. Conducted over Zoom due to the COVID-19 pandemic. |Meteorologists||Climatic changes|||||||Would you state your name and share some about your background?|0:01:30|Can you talk about your family's history with Gatlinburg?|0:05:59|Will you tell us about your career as a climate scientist and the work you do now at Creation Care?|0:05:59|What was the Summer and Fall in 2016 like?|0:11:42|Have you been back to the area since the wildfire?|0:18:57|How would you assess the recovery effort from Gatlinburg?|0:20:13|Are there other impacts of climate change that people might be seeing in the East Tennessee region?|0:27:42|What is your assessment of both the public perception of this being a climate fueled event and climate change in general in the East Tennessee region?|0:30:31|You talked about what local governments can do for climate change, what can individuals do?|0:35:25|What was the personal impact of the event on you and your work?|0:43:15|Is there anything we haven't talked about that you would like to share?|0:46:31|||||||||||||||||||||||||||||||||||||||||||||||||||||||||||||||||||||||||||||||||||||||||||||||||||||||||||||||||||||||||||||||||||||||||||||||||||||||||||||||||||6/23/1986|Lawrenceville, GA|1990|%B.S. Geology, Chemistry, University of Tennessee, Chattanooga;
Ph.D. Earth and Atmoshperic Sciences, Georgia Institute of Technology%|%Senior Director for Science and Policy at the Evangelical Environmental Network;
Policy Fellow at the U.S. Department of Energy Office of Science
Research Scientist appointments at Smithsonian National Museum of Natural History, the Johns Hopkins University, University of Michigan, and Georgia Institute of Technology%|I have been an active member in my church communities since a teenager, where I attended Fairview United Methodist Church in Blount County. In 2016, together with my husband, I started a new non-denominational church congregation in Washington, DC called Grace Capital City. ||The Rising from the Ashes Oral History Project collects personal accounts of the Chimney Tops II Wildfires of 2016, and The University of Tennessee holds no liability for statements made in the recordings. These accounts reflect the opinions of the narrators, and thus they are subjective and should not be considered verified or comprehensive. Oral history interviews may be used alongside other primary and secondary source materials to gain a fuller understanding of historical events.||
20200612_Rouse_Jeff||Interview with Jeff Rouse, 2020-06-12|0:00:15|1:05:03|%Creative Commons Attribution 4.0 International License 
https://creativecommons.org/licenses/by/4.0%||Rouse, Jeff|||Kaufman, Casey|6/12/2020|Murfreesboro, Tennessee|Michigan|motion pictures (visual works) http://vocab.getty.edu/aat/300136900|Video interview with Jeff Rouse, volunteer with Samaritan's Purse, conducted by Casey Kaufman. Rouse discusses his background with Samaritan's Purse before detailing the efforts of the organization in Gatlinburg after the wildfires. Conducted over Zoom due to the COVID-19 pandemic.|Recovery specialists||Social service|||||||Would you state your name and tell us about yourself?|0:00:51|Can you tell us about the mission of Samaritan's Purse and what drew you to them?|0:02:42|What were some of the other deployments like with Samaritan's Purse?|0:08:26|When did you first get the call about heading to Gatlinburg and when did you first hear about the fire?|0:15:39|What are the expectations of the volunteers? What are you orienting them to?|0:19:15|Are the volunteers usually first timers or veterans?|0:20:48|How do the wildfire victims sign up to be recepients of Samaritan's Purse?|0:21:33|As part of the site leadership team, what does that entail?|0:23:54|Can you talk about your experiences going out and meeting these  families from the Gatlinburg fire?|0:24:44|From your expertise in construction, when you were going to these homes, did you ever think about how the houses could be better constructed for fire prevention?|0:41:11|Have you been back to Gatlinburg since?|0:43:40|When you did go back, did it seem like Gatlinburg was recovering?|0:45:03|Do you feel that some of the people you helped have been able to recover fincancially and rebuild their lives?|0:46:09|Did you ever see any of the friction amongst the community after the disaster?|0:47:36|Do you feel that people are making provisions for future disasters? Do you see this in any of the disasters you've served in?|0:49:06|How did the Gatlinburg deployment affect you mentally or spiritually?|0:51:44|Was there anything good or surprising that came out of this?||||||||||||||||||||||||||||||||||||||||||||||||||||||||||||||||||||||||||||||||||||||||||||||||||||||||||||||||||||||||||||||||||||||||||||||||||||||||4/24/1966|Owosso, MI||Highschool|Construction||Christian who likes to help people in need|The Rising from the Ashes Oral History Project collects personal accounts of the Chimney Tops II Wildfires of 2016, and The University of Tennessee holds no liability for statements made in the recordings. These accounts reflect the opinions of the narrators, and thus they are subjective and should not be considered verified or comprehensive. Oral history interviews may be used alongside other primary and secondary source materials to gain a fuller understanding of historical events.||
20200619_Smith_Tommy||Interview with Tommy Smith, 2020-06-19|0:00:20|0:45:04|%Creative Commons Attribution 4.0 International License 
https://creativecommons.org/licenses/by/4.0%||Smith, Tommy|||Kaufman, Casey|6/19/2020|Murfreesboro, Tennessee|Virginia|sound recordings http://vocab.getty.edu/aat/300028633|Audio interview with Tommy Smith, volunteer with Samaritan's Purse, conducted by Casey Kaufman. Smith details his personal experiences volunteering with the organization in Gatlinburg and the families that he encountered. Conducted over Zoom due to the COVID-19 pandemic.|Recovery specialists||Social service|||||||Would you state your name and tell us about your background?|0:01:03|Can you tell us about what drove you to begin working with Samaritan's Purse? Can you tell us about Samaritan's Purse?|0:02:23|What was the experience of receiving the call to go to Gatlinburg like?|0:04:57|So you were already following what was happening on the news before receiving a call?|0:06:27|After getting to Gatlinburg, what transpired? What does the Samaritan's Purse operation look like? How does it take shape?|0:07:18|You were stationed at the First Baptist Church in Gatlinburg? What was it like when you arrived a week after the fire?|0:08:57|Can you tell us about the experiences you had at the sites of homeowners where you were sifting through ashes?|0:09:56|Was this the first wildfire that you assisted on with Samaritan's Purse?|0:12:22|Are there any other specific memories from meeting with these homeowners?|0:13:35|What kind of impact did this deployment have on you emotionally or spiritually?|0:36:03|Have you gone back to Gatlinburg since the deployment?|0:39:27|After going back, does it seem like the community is recovering from the event?|0:45:10|Is there anything else that we haven't discussed that you would like to?|00:|||||||||||||||||||||||||||||||||||||||||||||||||||||||||||||||||||||||||||||||||||||||||||||||||||||||||||||||||||||||||||||||||||||||||||||||||||||||||||||||12/13/1956|Bedford, VA||Highschool|Logger|%Volunteer with Samaritan's Purse;
Disaster Relief%||The Rising from the Ashes Oral History Project collects personal accounts of the Chimney Tops II Wildfires of 2016, and The University of Tennessee holds no liability for statements made in the recordings. These accounts reflect the opinions of the narrators, and thus they are subjective and should not be considered verified or comprehensive. Oral history interviews may be used alongside other primary and secondary source materials to gain a fuller understanding of historical events.||
20200619_Grooms_Sheila||Interview with Sheila Grooms, 2020-06-19|0:00:00|1:33:27|Release not yet received||Grooms, Sheila|||Wise, Ken|6/19/2020|Knoxville, Tennessee|Newport, TN|motion pictures (visual works) http://vocab.getty.edu/aat/300136900|Video interview with Sheila Grooms, respiratory therapist with LeConte Medical Center, conducted by Ken Wise. Grooms discusses the assistance she provided to victims of the fire at the medical center and also while volunteering at Rocky Top Sports World. Conducted over Zoom due to the COVID-19 pandemic.|Medical personnel||Respiratory therapists|||||||Can you state your name and what organization you are affiliated with?|0:00:42|How hong have you been working in Sevierville?|0:00:58|What do you do at the LaConte Medical Center?|0:01:07|When did you first become aware of the fire on the Chimney Tops?|0:02:04|Was there any concern initially that this fire was different from previous ones?|0:03:12|What road were you coming into Sevierville on?|0:04:37|What did the fire look like on your way in?|0:05:13|Was this the evening just before the fire went into Gatlinburg or the the evening after?|0:05:48|When you got to work, what was transpiring there?|0:06:30|What were you and you colleagues anticipating?|0:07:22|As you were preparing, when did you realize that things were not what you expected?|0:08:06|What types of injuries were coming into the hospital when the firetrucks and helicopters arrived?|0:09:10|Can you describe what you saw and how you felt? What made the image of that sky stick with you?|0:10:56|What time was it when you went out and saw all the equipment and vehicles?|0:12:57|Can you describe what happened when the emergency vehicles began to bring in patients?|0:13:15|Why were you scared when these patients were coming in? Can you describe how you were feeling?|0:14:54|What kind of volume were you seeing that night?|0:16:53|What kind of anxiety or anticipation were you feeling?|0:18:07|Did the patients keep coming through the whole night?|0:19:25|Are there any specific memories from that night that still stand out to you?|0:21:21|What else happened that night after communications started to go down?|0:25:52|Where is the hospital located in relation to more prominent landmarks?|0:29:06|What was driving some of the rumors while the communications were down?|0:30:41|Were you worried that your family was in the path of the ifre?|0:31:54|What attempts did you make to get in contact with your family? what failed?|0:33:31|What transpires as you get further into the night?|0:35:04|Was it just the Park Vista that calls were coming from, or all of Gatliburg?|0:37:46|How did you respond when a call comes in from an elderly couple in an elevator?|0:40:13|Did you stay on the phone with this couple until help arrived at the scene?|0:40:58|Did you ever have to evacuate the hospital?|0:41:27|What was the reaction at the hospital immediately after the fire?|0:44:26|What did you see when you first went into Rocky Top the day after the fire?|0:47:32|What were you doing at Rocky Top?|0:49:45|Can you describe what the after effects looked like? What made it so scary?|0:51:54|What was it like dealing with an epileptic patient, while there is a crowd surrounding you?|0:55:26|What kind of injuries were you seeing on the first responders?|1:08:13|How would you assess the short-term relief efforts you witnessed at Rocky Top?|1:08:43|Did the Red Cross and volunteers handle these efforts well?|1:09:46|Was this response similar to that of the hospital where you work?|1:12:06|Was there anything about the whole fire event that was surprising?|1:13:09|You encountered several people in trouble during this time, did you follow up with any of these patients afterwards?|1:15:24|What emotional impact did this event have on you?|1:16:28|Was there anything good that came out of this fire event?|1:18:06|Did you have the chance to see how this event affected community relations in Gatlinburg?|1:19:17|Is there anything else that you would like to share?|1:20:37|As a respiratory therapist, how was dealing with victims from the wildfires similar to the current corona virus?|1:24:30|Are you seeing tourists or locals with COVID-19?|1:29:14||||||||||||||||||||||||||||||||||||||||||||||||||||||||||||||||||||||||||||||||||||||||||||||||||The Rising from the Ashes Oral History Project collects personal accounts of the Chimney Tops II Wildfires of 2016, and The University of Tennessee holds no liability for statements made in the recordings. These accounts reflect the opinions of the narrators, and thus they are subjective and should not be considered verified or comprehensive. Oral history interviews may be used alongside other primary and secondary source materials to gain a fuller understanding of historical events.|%00:21:49 I can't mention any specific names.
01:29:41 "I don't know if this will get me in trouble" NO EDITS YET MADE TO VIDEO %|Not received
2020-709_Schubert_Emily||Interview with Emily Schubert, 2020-07-09|0:00:50|1:08:53|%Creative Commons Attribution 4.0 International License 
https://creativecommons.org/licenses/by/4.0%||Schubert, Emily|||Kaufman, Casey|7/9/2020|Murfreesboro, Tennessee|Baltimore, MD|motion pictures (visual works) http://vocab.getty.edu/aat/300136900|Video interview with Emily Schubert, former artist in residence at Arrowmont, conducted by Casey Kaufman. Schubert discusses her role at Arrowmont before recounting the events of the wildfires. She also details how the event has affected her and her art over the long term. Conducted over Zoom due to the COVID-19 pandemic.|Individuals (tourists or locals) directly affected by the fire||Artists|Evacuation of civilians||Arrowmont School of Arts and Crafts||||Can you state your name and tell us about yourself?|0:01:30|Can you tell us a little about Arrowmont School of Arts and Crafts' mission and what your fellowship entailed? What was your day-to-day?|0:04:24|Can you tell us about the days or weeks leading up to the wildfires?|0:09:18|Walk us through that day of the fires. You said that you were teaching a class of students?|0:16:02|Did the artists needing to drop off pieces seem disturbed at that point?|0:19:22|Did you have to leave things behind at Arrowmont?|0:30:04|How were you able to stay in touch with family and friends during that time?|0:36:26|What did your residency look like after the fire?|0:48:44|What are some of the long-term impacts this event had on you and your work?||||||||||||||||||||||||||||||||||||||||||||||||||||||||||||||||||||||||||||||||||||||||||||||||||||||||||||||||||||||||||||||||||||||||||||||||||||||||||||||||||||||||1/1/1991|Cincinnati, OH||Bachelor of Fine Arts in Fiber & Textile Art, Maryland Institute College of Art|%project assistant for traveling
broadway shows, art teacher, museum educator, summer camp manager, 
small-scale organic farmer, urban farmer, to puppet builder, festival curator and MC%|Host Batlimore-based puppet slams at the local puppet theater and occasionally teach community art workshops||The Rising from the Ashes Oral History Project collects personal accounts of the Chimney Tops II Wildfires of 2016, and The University of Tennessee holds no liability for statements made in the recordings. These accounts reflect the opinions of the narrators, and thus they are subjective and should not be considered verified or comprehensive. Oral history interviews may be used alongside other primary and secondary source materials to gain a fuller understanding of historical events.||
20200721_Miller_Melisa||Interview with Melisa Miller, 2020-07-21|0:00:00|0:39:33|%Creative Commons Attribution 4.0 International License 
https://creativecommons.org/licenses/by/4.0%||Miller, Melisa|||Kaufman, Casey|7/21/2020|Murfreesboro, Tennessee|Johnson City, Tennessee|motion pictures (visual works) http://vocab.getty.edu/aat/300136900|Video interview with Melisa Miller, executive vice president and chief operating officer of Appalachian Service Project, conducted by Casey Kaufman. Miller discusses the background of ASP before explaining the role the organization played in the aftermath of the wildfires. She recounts various families that ASP helped both through home rebuilds and ministering. Conducted over Zoom due to the COVID-19 pandemic.|Recovery specialists||Social service|||||||Would you state your name and tell us about yourself?|0:00:42|Can you tell us a little about Appalachian Service Project and its mission?|0:01:50|How does someone go about getting involved with ASP?|0:03:58|How long have you been with ASP?|0:05:54|Can you tell us about the weeks and days leading up to the wildfires? What projects were you working on?|0:06:19|Once you decided the wildfires were an opportunity for ASP, how did you organize the response?|0:11:52|What is the application process like, or how do you select which families to work with?|0:18:13|What are some memories that have stuck with you from some of the families you worked with?|0:21:39|What was it like to finish up these projects and stay in touch with the families throughout?|0:24:42|Were the families involved in the design of their new home, or are there already templates?|0:27:44|What has the impact been on these families? Have you kept up with any of them?|0:31:00|What does the ministry aspect of your work look like?|0:36:18|Is there anything else that you would like to talk about?|0:38:23|||||||||||||||||||||||||||||||||||||||||||||||||||||||||||||||||||||||||||||||||||||||||||||||||||||||||||||||||||||||||||||||||||||||||||||||||||||||||||||||11/25/1981|Orlando, FL||%B.S. Building Construction Management, University of Florida;
M.A. Christian Practice, Duke University%|Non-profit management|%100+ Tri-Cities Women who Care - member
ReFrame Association - board member%||The Rising from the Ashes Oral History Project collects personal accounts of the Chimney Tops II Wildfires of 2016, and The University of Tennessee holds no liability for statements made in the recordings. These accounts reflect the opinions of the narrators, and thus they are subjective and should not be considered verified or comprehensive. Oral history interviews may be used alongside other primary and secondary source materials to gain a fuller understanding of historical events.||
20200804_Ray_Lukas||Interview with Lukas Ray, 2020-08-04|0:00:00|0:47:49|%Creative Commons Attribution 4.0 International License 
https://creativecommons.org/licenses/by/4.0%||Ray, Lukas|||Kaufman, Casey|8/4/2020|Murfreesboro, Tennessee|West Virginia|motion pictures (visual works) http://vocab.getty.edu/aat/300136900|Video interview with Lukas Ray, formerly with Appalachian Service Project, conducted by Casey Kaufman. Ray discusses the process through which families and individuals were identified for the home rebuilding process. He  Conducted over Zoom due to the COVID-19 pandemic.|Recovery specialists||Social service|||||||Can you provide an overview of Appalachian Service Project and what your role was?|0:04:37|As you arrive in June 2017, what was it like recruiting volunteers? How did you get people on board and what were they like?|0:11:09|How did you identify the families and individuals that received assistance?|0:15:36|Can you talke about some of the site visits you did to kick off the evaluations of the homeowners? What were the situations of some of the people at that time?|0:22:54|Are there any other memories that you want to share of homeowners or the rebuild process?|0:28:27|How did future planning for another fire affect the rebuild process?|0:35:19|Have you been able to stay in touch with any of the homeowners? What has the process looked like over the past few years as they have settled in?|0:41:00|Is there anything else that we haven't discusses that you would like to share?|0:46:30||||||||||||||||||||||||||||||||||||||||||||||||||||||||||||||||||||||||||||||||||||||||||||||||||||||||||||||||||||||||||||||||||||||||||||||||||||||||||||||||||||||||||||||||The Rising from the Ashes Oral History Project collects personal accounts of the Chimney Tops II Wildfires of 2016, and The University of Tennessee holds no liability for statements made in the recordings. These accounts reflect the opinions of the narrators, and thus they are subjective and should not be considered verified or comprehensive. Oral history interviews may be used alongside other primary and secondary source materials to gain a fuller understanding of historical events.||
20200813_DeSear_Ryan||Interview with Ryan DeSear, 2020-08-13|0:00:00|0:48:15|%Creative Commons Attribution 4.0 International License 
https://creativecommons.org/licenses/by/4.0%||DeSear, Ryan|||Kaufman, Casey|8/13/2020|Murfreesboro, Tennessee|Ripley's Aquarium of the Smokies, Gatlinburg, TN|motion pictures (visual works) http://vocab.getty.edu/aat/300136900|Video interview with Ryan DeSear, General Manager of Ripley's Aquarium of the Smokies, coducted by Casey Kaufman. DeSear provides a background for the aquarium and Ripley's Entertainment before discussing the wildfires in 2016. He recounts the challenges faced by the aquarium's staff and the aid that was provided by Ripley's. He also discusses the challenges presented by the COVID-19 pandemic. Conducted over Zoom due to the COVID-19 pandemic.|Individuals (tourists or locals) directly affected by the fire|||||||||Can you state your name and tell us about yourself?|0:00:42|Can you tell us about Ripley's Entertainment and the aquarium specifically?|0:01:25|How long has the aquarium been around, what kind of animals does it house?|0:03:39|What were your experiences in the days leading up to the wildfires? What was happening at the aquarium?|0:05:11|What transpired that afternoon and into that evening?|0:09:56|How do you feel the media handled the wildfires and what was happening in Gatlinburg?|0:27:11|Can you talk about your disaster plan for the aquarium?|0:30:45|Can you expand on what Amanda's role was and how housing was provided to the staff?|0:33:40|How did employees react to finding out about the housing assistance?|0:34:39|How is the COVID-19 pandemic affecting the aquarium?|0:35:46|As someone who studied history, how do you see the history of the wildfires continuing?|0:44:15||||||||||||||||||||||||||||||||||||||||||||||||||||||||||||||||||||||||||||||||||||||||||||||||||||||||||||||||||||||||||||||||||||||||||||||||||||||||||||||||||||||||||The Rising from the Ashes Oral History Project collects personal accounts of the Chimney Tops II Wildfires of 2016, and The University of Tennessee holds no liability for statements made in the recordings. These accounts reflect the opinions of the narrators, and thus they are subjective and should not be considered verified or comprehensive. Oral history interviews may be used alongside other primary and secondary source materials to gain a fuller understanding of historical events.||
20200814_Barnett_Helen||Interview with Helen Barnett, 2020-08-14|0:00:00|0:28:01|%Creative Commons Attribution 4.0 International License 
